{"event_id":"195937ce-6501-4e19-869b-2bc9dd883595","vehicle_id":"f6298b64-a9a7-4ced-90bc-b1a727525407","service_date":"2026-10-11","service_type":"tyre_rotation","odometer_km":12000,"source":"self_upload","stored":true,"verification":{"status":"flagged","checks":[{"code":"date_not_future","passed":true,"message":"Service date is not in the future."},{"code":"date_after_registration","passed":true,"message":"Service date is on or after registration date (2024-10-21)."},{"code":"odometer_monotonic","passed":false,"message":"Odometer reading 12000 violates monotonicity (expected >= 15000)."},{"code":"odometer_rate_plausible","passed":true,"message":"Odometer rate is plausible (<= 1000 km/day)."},{"code":"not_duplicate","passed":true,"message":"No duplicate service record found."},{"code":"daily_limit","passed":true,"message":"Daily self-upload limit not exceeded (1 of 5 records stored today)."}]},"recorded_at":"2026-10-21T17:27:14.326815255Z"}