{"event_id":"0045b3af-1ac0-4a96-b41f-d0e3becfc28a","vehicle_id":"f6298b64-a9a7-4ced-90bc-b1a727525407","service_date":"2026-09-21","service_type":"oil_change","odometer_km":15000,"source":"self_upload","stored":true,"verification":{"status":"accepted","checks":[{"code":"date_not_future","passed":true,"message":"Service date is not in the future."},{"code":"date_after_registration","passed":true,"message":"Service date is on or after registration date (2024-10-21)."},{"code":"odometer_monotonic","passed":true,"message":"No neighbouring readings to compare for monotonicity."},{"code":"odometer_rate_plausible","passed":true,"message":"No neighbouring readings to compare for rate plausibility."},{"code":"not_duplicate","passed":true,"message":"No stored records found to compare for duplicates."},{"code":"daily_limit","passed":true,"message":"Daily self-upload limit not exceeded (0 of 5 records stored today)."}]},"recorded_at":"2026-10-21T17:27:14.187317890Z"}